<?xml version="1.0" encoding="UTF-8"?>
<!--这是一行注释-->

<Students
    xmlns:xsi="http://www.w3.org/2001/XMLSchema-instance"
    xmlns="000000"
    xsi:schemaLocation="000000 Students.xsd"
>
    <student id="01">
        <name>啦啦啦</name>
        <age>0</age>
        <info>叽里呱啦&lt;&gt;&amp;&apos;&quot;</info>

    </student>

    <student id="02">
        <name>嘟嘟嘟</name>
        <age>5</age>
        <info>叽里呱啦&lt;&gt;&amp;&apos;&quot;</info>

    </student>
</Students>